<ipv:createIPVPNServiceResponse xmlns:xsi="http://www.w3.org/2001/XMLSchema-instance"
 xsi:schemaLocation="http://ipvpn.ossuc.com ../../../src/main/resources/etc/IPVPNServiceOverJMS.xsd"
 xmlns:ipv="http://ipvpn.ossuc.com">
    <ipv:createIPVPNServiceReturn>Successful</ipv:createIPVPNServiceReturn>
    <ipv:vpnId>vpnEmrald01</ipv:vpnId>
    <ipv:listOfvCPE>
        <ipv:vCPE>
            <ipv:vCpeId>VCPE-EM-001</ipv:vCpeId>
            <ipv:vCpeStatus>Ready</ipv:vCpeStatus>
        </ipv:vCPE>
        <ipv:vCPE>
            <ipv:vCpeId>VCPE-EM-002</ipv:vCpeId>
            <ipv:vCpeStatus>Ready</ipv:vCpeStatus>
        </ipv:vCPE>
        <ipv:vCPE>
            <ipv:vCpeId>VCPE-EM-003</ipv:vCpeId>
            <ipv:vCpeStatus>Ready</ipv:vCpeStatus>
        </ipv:vCPE>
    </ipv:listOfvCPE>
</ipv:createIPVPNServiceResponse>
